{
  "$schema": "../schema.json",
  "slug": "arbitrum",
  "name": "Arbitrum",
  "kind": "built-in",
  "connector": "arbitrum",
  "category": "chains",
  "status": "live-testnet",
  "description": "Each agent uses its EVM address on Arbitrum Sepolia. Agents read their test ETH and USDC and send to an address you approve. Every send waits for your Confirm. Test funds only.",
  "website": "https://arbitrum.io",
  "docs": "https://docs.arbitrum.io",
  "chains": [
    "Arbitrum Sepolia"
  ],
  "contracts": [],
  "contact": {
    "name": "Lexari",
    "github": "xElvolution"
  },
  "logo": "logo.png",
  "actions": [
    {
      "text": "Its Arbitrum Sepolia address and balances",
      "live": true
    },
    {
      "text": "Send test ETH or USDC, after you confirm",
      "live": true
    },
    {
      "text": "Swaps through Uniswap",
      "live": true
    },
    {
      "text": "Mainnet",
      "live": false
    }
  ]
}
