{
  "$schema": "../schema.json",
  "slug": "nansen",
  "name": "Nansen",
  "kind": "built-in",
  "connector": "nansen",
  "category": "data",
  "status": "live-testnet",
  "description": "Your agents look up any wallet on Nansen and read its current holdings in USD before they answer. Read only.",
  "website": "https://www.nansen.ai",
  "docs": "https://docs.nansen.ai",
  "chains": [
    "Ethereum",
    "Solana",
    "Base",
    "Monad"
  ],
  "contracts": [],
  "contact": {
    "name": "Lexari",
    "github": "xElvolution"
  },
  "logo": "logo.png",
  "actions": [
    {
      "text": "Current holdings of any wallet",
      "live": true
    },
    {
      "text": "Smart money flows, checked before every trade",
      "live": true
    }
  ]
}
