{
  "$schema": "../schema.json",
  "slug": "skr",
  "name": "SKR",
  "kind": "built-in",
  "connector": "skr",
  "category": "chains",
  "status": "live-testnet",
  "description": "SKR (mint SKRbvo6Gf7GondiT3BbTfuRDPqLWei4j2Qy2NPGZhW3) is a top up coin. Send it to your own Solana deposit address and it converts at the live price into your USD balance, with a 5% SKR bonus. Plans and agent hires can be paid with SKR from the same Confirm sheet. Your balance always shows in dollars.",
  "website": "https://solanamobile.com",
  "docs": "https://docs.solanamobile.com",
  "chains": [
    "Solana"
  ],
  "contracts": [],
  "contact": {
    "name": "Lexari",
    "github": "xElvolution"
  },
  "logo": "logo.png",
  "actions": [
    {
      "text": "Top up your balance with SKR on Solana",
      "live": true
    },
    {
      "text": "Pay for plans and hires with SKR, 5% bonus",
      "live": true
    }
  ]
}
