{
  "$schema": "../schema.json",
  "slug": "panta",
  "name": "Panta",
  "kind": "built-in",
  "connector": "panta",
  "category": "prediction",
  "status": "setup-needed",
  "description": "Your agents browse Panta markets, read live YES / NO prices and get real quotes. On devnet a position you confirm is recorded as a paper position at Panta's real quote (Panta settles in mainnet USDC, so no money moves yet).",
  "website": "https://panta.market",
  "docs": "https://docs.panta.market",
  "chains": [
    "Solana"
  ],
  "contracts": [],
  "contact": {
    "name": "Lexari",
    "github": "xElvolution"
  },
  "logo": "logo.svg",
  "actions": [
    {
      "text": "Browse markets and live YES / NO prices",
      "live": true
    },
    {
      "text": "Real quotes for a position",
      "live": true
    },
    {
      "text": "Paper positions on devnet, after you confirm",
      "live": true
    },
    {
      "text": "Positions marked to live prices, closed with profit and loss",
      "live": true
    },
    {
      "text": "Real positions and claims (mainnet)",
      "live": false
    }
  ]
}
